{

  "error": "404 ERROR",
  "mainMessage": "죄송합니다. 요청하신 페이지를 찾을 수 없습니다.",
  "subMessages": {
    "notExist": "페이지가 존재하지 않거나, 삭제되어 더이상 사용할 수 없는 페이지 입니다.",
    "checkAddress": "입력하신 주소가 정확한지 다시 확인하거나 홈으로 이동해주세요."
  },
  "button": {
    "home": "홈으로 이동"
  },
  "aria": {
    "tigerLogo": "호랑이 로고"
  }
}
